{
  "schema_version": "emlis.reception_assistance_dictionary.v1",
  "dictionary_id": "emlis_reception_assistance_dictionary",
  "dictionary_version": "emlis.reception_assistance_dictionary.initial_two_stage_reception.2026-05-26.phase20_9_phase19_withdrawn",
  "purpose": "EmlisAIのEmlisから sectionを、ユーザーの明示反応に基づいて自然に受け取るための内部補助辞書。一般辞書でも完成返答テンプレでもない。",
  "non_goals": [
    "一般辞書",
    "完成返答文テンプレ集",
    "診断辞書",
    "人格分類辞書",
    "外部知識補完",
    "Piece生成辞書",
    "Analysis期間観測辞書",
    "public response key追加"
  ],
  "global_policies": {
    "not_general_dictionary": true,
    "user_reaction_is_primary": true,
    "event_hint_must_not_create_emotion": true,
    "unknown_word_meaning_must_not_be_asserted": true,
    "completed_reply_template_forbidden": true
  },
  "unknown_word_policy": {
    "general_dictionary_used": false,
    "unknown_word_meaning_asserted": false,
    "meaning_assertion_allowed": false,
    "event_hint_can_support_mode_only": true,
    "event_hint_must_not_create_emotion": true
  },
  "reaction_cues": [
    {
      "cue_id": "disgust",
      "surface_patterns": [
        "気持ち悪い",
        "気持ちわるい",
        "きもちわるい",
        "きもい",
        "キモい",
        "嫌",
        "いや",
        "最悪"
      ],
      "reaction_family": "negative_daily_reaction",
      "allowed_reception_modes": [
        "daily_unpleasant_reception"
      ],
      "must_not_infer": [
        "trauma",
        "danger",
        "diagnosis",
        "period_tendency"
      ]
    },
    {
      "cue_id": "fear",
      "surface_patterns": [
        "怖い",
        "こわい",
        "恐怖",
        "怖さ"
      ],
      "reaction_family": "fear_reaction",
      "allowed_reception_modes": [
        "daily_unpleasant_reception",
        "uncertainty_support"
      ],
      "must_not_infer": [
        "actual_danger_level",
        "trauma",
        "future_risk"
      ]
    },
    {
      "cue_id": "anger_irritation",
      "surface_patterns": [
        "イライラ",
        "いらいら",
        "怒り",
        "怒っ",
        "腹が立",
        "ムカつ",
        "むかつ"
      ],
      "reaction_family": "anger_reaction",
      "allowed_reception_modes": [
        "daily_unpleasant_reception",
        "standard_state_answer"
      ],
      "must_not_infer": [
        "target_is_bad",
        "anger_is_correct",
        "attack_is_justified"
      ]
    },
    {
      "cue_id": "joy_or_surprise",
      "surface_patterns": [
        "嬉しい",
        "うれしい",
        "びっくり",
        "驚",
        "動揺",
        "ほっと",
        "楽しい"
      ],
      "reaction_family": "positive_daily_reaction",
      "allowed_reception_modes": [
        "daily_positive_reception",
        "self_understanding_follow"
      ],
      "must_not_infer": [
        "stable_recovery",
        "personality_change",
        "future_success"
      ]
    },
    {
      "cue_id": "fatigue_or_load",
      "surface_patterns": [
        "疲れ",
        "くたくた",
        "しんど",
        "元気がない",
        "我慢",
        "余裕ない"
      ],
      "reaction_family": "load_reaction",
      "allowed_reception_modes": [
        "self_understanding_follow",
        "standard_state_answer"
      ],
      "must_not_infer": [
        "medical_condition",
        "weakness",
        "inability"
      ]
    },
    {
      "cue_id": "uncertainty",
      "surface_patterns": [
        "これでいいのかな",
        "大丈夫なのかな",
        "頑張れてるかな",
        "不安",
        "自信がなく",
        "自信ない"
      ],
      "reaction_family": "uncertainty_reaction",
      "allowed_reception_modes": [
        "uncertainty_support",
        "self_denial_support"
      ],
      "must_not_infer": [
        "failure",
        "incapable_identity",
        "future_failure"
      ]
    },
    {
      "cue_id": "self_denial",
      "surface_patterns": [
        "中途半端",
        "自分を好き",
        "好きになれる",
        "自信をつけたい",
        "なんで私はこう",
        "自分を責め",
        "自分を追い込"
      ],
      "reaction_family": "self_negative_reaction",
      "allowed_reception_modes": [
        "self_denial_support",
        "uncertainty_support"
      ],
      "must_not_infer": [
        "identity_is_true",
        "identity_claim_is_fact",
        "personality_defect",
        "diagnosis"
      ]
    },
    {
      "cue_id": "self_understanding_effort",
      "surface_patterns": [
        "向き合",
        "気づいて",
        "優しく見",
        "ちゃんと見て",
        "見てあげる",
        "整えて",
        "直したい",
        "挑戦",
        "頑張りたい",
        "小さくても大事"
      ],
      "reaction_family": "self_understanding_effort",
      "allowed_reception_modes": [
        "self_understanding_follow",
        "self_denial_support",
        "uncertainty_support"
      ],
      "must_not_infer": [
        "already_recovered",
        "growth_complete",
        "future_success"
      ]
    },
    {
      "cue_id": "effort_pace",
      "surface_patterns": [
        "自立",
        "動けるようになりたい",
        "体調をちゃんと見",
        "続けていけるペース",
        "長く続け",
        "無理をして頑張りすぎるんじゃなくて"
      ],
      "reaction_family": "effort_pace_reaction",
      "allowed_reception_modes": [
        "standard_state_answer",
        "effort_support"
      ],
      "must_not_infer": [
        "success_guarantee",
        "action_instruction",
        "money_is_cause"
      ]
    }
  ],
  "event_hints": [
    {
      "hint_id": "public_unpleasant_encounter",
      "surface_patterns": [
        "立ちション",
        "すれ違",
        "出くわ",
        "見かけ",
        "遭遇"
      ],
      "event_family": "daily_event_encounter",
      "can_support_modes": [
        "daily_unpleasant_reception"
      ],
      "cannot_alone_infer": [
        "fear",
        "anger",
        "disgust",
        "danger",
        "trauma",
        "actual_danger_level"
      ]
    },
    {
      "hint_id": "positive_change_after_work_streaming",
      "surface_patterns": [
        "配信",
        "誰かとお話",
        "話したい",
        "仕事があった日",
        "大きな変化"
      ],
      "event_family": "positive_daily_change",
      "can_support_modes": [
        "daily_positive_reception",
        "self_understanding_follow"
      ],
      "cannot_alone_infer": [
        "joy",
        "stable_recovery",
        "personality_change",
        "future_success"
      ]
    },
    {
      "hint_id": "self_confidence_uncertainty_attempt",
      "surface_patterns": [
        "自信をつけたい",
        "中途半端",
        "色々挑戦",
        "これでいいのかな",
        "大丈夫なのかな"
      ],
      "event_family": "self_confidence_uncertainty_attempt",
      "can_support_modes": [
        "self_denial_support",
        "uncertainty_support",
        "self_understanding_follow"
      ],
      "cannot_alone_infer": [
        "identity_claim_is_fact",
        "failure",
        "future_failure"
      ]
    },
    {
      "hint_id": "self_blame_to_gentle_self_observation",
      "surface_patterns": [
        "自分を責め",
        "気持ちが沈",
        "向き合わないと",
        "優しく見て",
        "気持ちをちゃんと見て"
      ],
      "event_family": "self_understanding_direction",
      "can_support_modes": [
        "self_denial_support",
        "self_understanding_follow"
      ],
      "cannot_alone_infer": [
        "growth_complete",
        "already_recovered",
        "diagnosis"
      ]
    },
    {
      "hint_id": "independence_life_health_money_pace",
      "surface_patterns": [
        "自立",
        "生活のこと",
        "体調のこと",
        "お金のこと",
        "長く続けていけるペース"
      ],
      "event_family": "life_pace_effort_context",
      "can_support_modes": [
        "standard_state_answer",
        "effort_support"
      ],
      "cannot_alone_infer": [
        "independence_success",
        "money_is_cause",
        "health_cause",
        "action_instruction"
      ]
    },
    {
      "hint_id": "relationship_boundary_support_context",
      "surface_patterns": [
        "別れた",
        "関係の終わり",
        "友達",
        "変わらず",
        "怒ってくれて",
        "区切り",
        "返していきたい"
      ],
      "event_family": "relationship_boundary_support_context",
      "can_support_modes": [
        "self_understanding_follow",
        "standard_state_answer"
      ],
      "cannot_alone_infer": [
        "joy",
        "safety",
        "ex_partner_fault",
        "anger_is_correct",
        "stable_recovery",
        "growth_complete"
      ]
    }
  ],
  "reception_modes": [
    {
      "mode_id": "daily_unpleasant_reception",
      "activation": {
        "requires_event_fact_present": true,
        "requires_reaction_present": true,
        "requires_any_reaction_family": [
          "negative_daily_reaction",
          "fear_reaction",
          "anger_reaction"
        ],
        "excludes_structure_question": true,
        "excludes_safety_risk": true,
        "excludes_self_denial_primary": true,
        "event_hint_alone_can_activate": false
      },
      "ratio_preset": "daily_unpleasant_reception_light",
      "observation_policy": {
        "max_sentences": 1,
        "must_not_prompt_for_event_if_event_fact_present": true,
        "claim_strength": "single_input_soft"
      },
      "reception_policy": {
        "allowed_tone_family": "natural_short_reception",
        "min_sentences": 1,
        "max_sentences": 3,
        "allow_casual_first_reaction": true,
        "must_ground_to_explicit_reaction": true
      },
      "forbidden": [
        "target_judgement_agreement",
        "action_instruction",
        "diagnosis",
        "unknown_word_meaning_assertion"
      ]
    },
    {
      "mode_id": "daily_positive_reception",
      "activation": {
        "requires_event_fact_present": false,
        "requires_reaction_present": true,
        "requires_any_reaction_family": [
          "positive_daily_reaction"
        ],
        "excludes_structure_question": true,
        "excludes_safety_risk": true,
        "event_hint_alone_can_activate": false
      },
      "ratio_preset": "daily_positive_reception_light",
      "observation_policy": {
        "max_sentences": 1,
        "claim_strength": "single_input_soft"
      },
      "reception_policy": {